{
  "schema_version": 1,
  "candidate_key": "game:example-game",
  "sources": [
    {
      "source_id": "official-codes",
      "url": "https://official.example/codes",
      "title": "Official code announcement",
      "source_type": "official_page",
      "reliability": "official",
      "retrieved_at": "2026-08-07T00:00:00Z",
      "current_as_of": "2026-08-07T00:00:00Z"
    },
    {
      "source_id": "trusted-guide",
      "url": "https://trusted.example/example-game-codes",
      "title": "Independent current code check",
      "source_type": "guide",
      "reliability": "trusted",
      "retrieved_at": "2026-08-07T00:00:00Z",
      "current_as_of": "2026-08-07T00:00:00Z"
    }
  ],
  "page_evidence": [
    {
      "page_id": "codes-en",
      "source_ids": [
        "official-codes",
        "trusted-guide"
      ]
    }
  ],
  "claims": [
    {
      "claim_id": "code-example",
      "page_id": "codes-en",
      "text": "Replace this example with the exact current code claim",
      "claim_type": "redeem_code",
      "source_ids": [
        "official-codes"
      ],
      "status": "verified",
      "verified_at": "2026-08-07T00:00:00Z"
    }
  ]
}
